{
  "$schema": "https://json-schema.org/draft/2020-12/schema",
  "title": "Akkoord",
  "description": "Akkoord van de opdrachtgever op een offerte. Vastlegging van wie, namens welke organisatie, wanneer, op welke versie en in welke vorm.",
  "type": "object",
  "properties": {
    "id": {
      "type": "string",
      "format": "uuid",
      "description": "Id van dit bericht. Bepaalt de idempotentie."
    },
    "quote_id": {
      "type": "string",
      "format": "uuid",
      "description": "Id van de offerte."
    },
    "quote_hash": {
      "type": "string",
      "pattern": "^[0-9a-f]{64}$",
      "description": "De snapshot_hash van de offerte waarvoor akkoord wordt gegeven."
    },
    "signer": {
      "type": "object",
      "properties": {
        "name": {
          "type": "string",
          "description": "Naam van de ondertekenaar aan de kant van de opdrachtgever."
        },
        "email": {
          "type": "string",
          "format": "email",
          "description": "E-mailadres van de ondertekenaar."
        },
        "function": {
          "type": "string",
          "description": "Functie van de ondertekenaar."
        }
      },
      "required": [
        "name",
        "email"
      ],
      "description": "Wie tekende."
    },
    "organisation": {
      "$ref": "organisation-ref.schema.json"
    },
    "signed_at": {
      "type": "string",
      "format": "date-time",
      "description": "Moment van tekenen. Met tijdzone (RFC 3339)."
    },
    "form": {
      "type": "string",
      "enum": [
        "own_instance",
        "signing_link",
        "uploaded_pdf"
      ],
      "description": "own_instance: getekend in de eigen instantie van de opdrachtgever; signing_link: getekend via een tekenlink op de instantie van de opdrachtnemer; uploaded_pdf: getekend document vastgelegd door de opdrachtnemer."
    },
    "jws": {
      "type": "string",
      "pattern": "^[A-Za-z0-9_-]+\\.[A-Za-z0-9_-]+\\.[A-Za-z0-9_-]+$",
      "description": "Compacte JWS (RFC 7515) van de instantie van de opdrachtgever. De payload is de canonieke JSON (RFC 8785) van de velden id, quote_id, quote_hash, signer, organisation, signed_at en form. Algoritme ES256 of PS256; de header bevat een kid dat verwijst naar een sleutel in de JWKS van de afzender. Verplicht bij form own_instance."
    },
    "document_sha256": {
      "type": "string",
      "pattern": "^[0-9a-f]{64}$",
      "description": "SHA-256 over het getekende document, bij form uploaded_pdf."
    }
  },
  "required": [
    "id",
    "quote_id",
    "quote_hash",
    "signer",
    "organisation",
    "signed_at",
    "form"
  ],
  "allOf": [
    {
      "if": {
        "properties": {
          "form": {
            "const": "own_instance"
          }
        },
        "required": [
          "form"
        ]
      },
      "then": {
        "required": [
          "jws"
        ]
      }
    },
    {
      "if": {
        "properties": {
          "form": {
            "const": "uploaded_pdf"
          }
        },
        "required": [
          "form"
        ]
      },
      "then": {
        "required": [
          "document_sha256"
        ]
      }
    }
  ]
}
