{
  "id": "4e5f6a7b-0000-4000-8000-000000000002",
  "quote_id": "9d3b6c0e-2f41-4c8a-b0d2-6a1f5e7c8b90",
  "quote_hash": "80cf1b6e929ab9e4885bddd6a14ea3064c4d83ca190b2eae92c455befc1694a4",
  "signer": {
    "name": "Voorbeeld Ondertekenaar",
    "email": "tekenbevoegde@opdrachtgever.example",
    "function": "Tekenbevoegde"
  },
  "organisation": {
    "tooi_uri": "https://identifier.overheid.nl/tooi/id/ministerie/mnre0000",
    "name": "Voorbeeldministerie",
    "unit_key": "directie-voorbeeld",
    "instance_uri": "https://grip.opdrachtgever.example"
  },
  "signed_at": "2026-06-10T14:30:00+02:00",
  "form": "own_instance",
  "jws": "eyJhbGciOiJFUzI1NiIsImtpZCI6InZvb3JiZWVsZC0yMDI2LTAxIn0.eyJmb3JtIjoib3duX2luc3RhbmNlIiwiaWQiOiI0ZTVmNmE3Yi0wMDAwLTQwMDAtODAwMC0wMDAwMDAwMDAwMDIiLCJvcmdhbmlzYXRpb24iOnsiaW5zdGFuY2VfdXJpIjoiaHR0cHM6Ly9ncmlwLm9wZHJhY2h0Z2V2ZXIuZXhhbXBsZSIsIm5hbWUiOiJWb29yYmVlbGRtaW5pc3RlcmllIiwidG9vaV91cmkiOiJodHRwczovL2lkZW50aWZpZXIub3ZlcmhlaWQubmwvdG9vaS9pZC9taW5pc3RlcmllL21ucmUwMDAwIiwidW5pdF9rZXkiOiJkaXJlY3RpZS12b29yYmVlbGQifSwicXVvdGVfaGFzaCI6IjgwY2YxYjZlOTI5YWI5ZTQ4ODViZGRkNmExNGVhMzA2NGM0ZDgzY2ExOTBiMmVhZTkyYzQ1NWJlZmMxNjk0YTQiLCJxdW90ZV9pZCI6IjlkM2I2YzBlLTJmNDEtNGM4YS1iMGQyLTZhMWY1ZTdjOGI5MCIsInNpZ25lZF9hdCI6IjIwMjYtMDYtMTBUMTQ6MzA6MDArMDI6MDAiLCJzaWduZXIiOnsiZW1haWwiOiJ0ZWtlbmJldm9lZ2RlQG9wZHJhY2h0Z2V2ZXIuZXhhbXBsZSIsImZ1bmN0aW9uIjoiVGVrZW5iZXZvZWdkZSIsIm5hbWUiOiJWb29yYmVlbGQgT25kZXJ0ZWtlbmFhciJ9fQ.ZWrdfT26s-5xil-JOwiismaZLqZAIycoUU2-BhKTczL9Icy80H7bO0owaWcbOyozlp2TCDboI0YQfyFz05JfJg"
}
